{
  "schemaVersion": "1.0",
  "updatedAt": "2026-08-07T09:21:09Z",
  "repos": [
    {
      "name": "retech-us/retech-web-automation",
      "label": "Web",
      "url": "https://github.com/retech-us/retech-web-automation",
      "contributorCount": 0
    },
    {
      "name": "retech-us/retech-mobile-automation",
      "label": "Mobile",
      "url": "https://github.com/retech-us/retech-mobile-automation",
      "contributorCount": 0
    },
    {
      "name": "retech-us/retech-api-automation",
      "label": "API",
      "url": "https://github.com/retech-us/retech-api-automation",
      "contributorCount": 0
    }
  ],
  "contributors": [],
  "totals": {
    "uniqueContributors": 0,
    "totalContributions": 0
  }
}
